{
  "baseOverrides": {},
  "hostIds": [
    12,
    45,
    49,
    68,
    70,
    79,
    82,
    84,
    87,
    101,
    104,
    109,
    234,
    235,
    236,
    1189,
    1251,
    1665,
    1806,
    2556
  ],
  "meta": {
    "commit": "0c38027504532826c9922e4db77e2c1d33554291",
    "eligibilityPolicy": "organic-classes-v1; special mechanical, herdable and mobile-building cases paused",
    "engineVerifiedInPinnedBuild": false,
    "fields": [
      "Unit.hit_points",
      "Unit.class_",
      "Unit.type",
      "Building.garrison_heal_rate",
      "Building.garrison_repair_rate",
      "EffectCommand attribute 108"
    ],
    "generatedBy": "scripts/garrison_healing_build.py",
    "patch": "DE Update 185872 (2026-09-22)",
    "repo": "SiegeEngineers/auto-mods",
    "sha256": "4aa2f0a719e88e5f1502517eddb27c669aeb40c2fe9d8c4f3eec7751c01e7baa"
  },
  "organicClasses": [
    0,
    4,
    6,
    12,
    18,
    23,
    36,
    43,
    44,
    47,
    59
  ],
  "rateTechs": {
    "441": {
      "count": 1,
      "effects": [
        {
          "op": "mul",
          "units": [
            79,
            234,
            235,
            236,
            1665
          ],
          "value": 6.0
        },
        {
          "op": "mul",
          "units": [
            10,
            12,
            14,
            18,
            19,
            20,
            30,
            31,
            32,
            45,
            47,
            49,
            51,
            68,
            70,
            71,
            82,
            84,
            86,
            87,
            101,
            103,
            104,
            105,
            109,
            116,
            129,
            130,
            131,
            132,
            133,
            137,
            141,
            142,
            153,
            209,
            210,
            276,
            463,
            464,
            465,
            498,
            562,
            563,
            564,
            565,
            584,
            585,
            586,
            587,
            598,
            1021,
            1189,
            1251,
            1734,
            1754,
            1806,
            1808,
            2556
          ],
          "value": 6.0
        }
      ],
      "requires": [
        102
      ]
    }
  },
  "units": {
    "10": {
      "class": 3,
      "eligibility": "unverified",
      "healRate": 0.5,
      "hp": 1800,
      "repairRate": 0.0,
      "type": 80
    },
    "1001": {
      "class": 13,
      "eligibility": "unverified",
      "healRate": null,
      "hp": 50,
      "repairRate": null,
      "type": 70
    },
    "1003": {
      "class": 13,
      "eligibility": "unverified",
      "healRate": null,
      "hp": 70,
      "repairRate": null,
      "type": 70
    },
    "1004": {
      "class": 22,
      "eligibility": "unverified",
      "healRate": null,
      "hp": 130,
      "repairRate": null,
      "type": 70
    },
    "1006": {
      "class": 22,
      "eligibility": "unverified",
      "healRate": null,
      "hp": 150,
      "repairRate": null,
      "type": 70
    },
    "1007": {
      "class": 36,
      "eligibility": "organic",
      "healRate": null,
      "hp": 55,
      "repairRate": null,
      "type": 70
    },
    "1009": {
      "class": 36,
      "eligibility": "organic",
      "healRate": null,
      "hp": 60,
      "repairRate": null,
      "type": 70
    },
    "101": {
      "class": 3,
      "eligibility": "unverified",
      "healRate": 0.25,
      "hp": 1500,
      "repairRate": 0.0,
      "type": 80
    },
    "1010": {
      "class": 36,
      "eligibility": "organic",
      "healRate": null,
      "hp": 50,
      "repairRate": null,
      "type": 70
    },
    "1012": {
      "class": 36,
      "eligibility": "organic",
      "healRate": null,
      "hp": 55,
      "repairRate": null,
      "type": 70
    },
    "1013": {
      "class": 6,
      "eligibility": "organic",
      "healRate": null,
      "hp": 40,
      "repairRate": null,
      "type": 70
    },
    "1015": {
      "class": 6,
      "eligibility": "organic",
      "healRate": null,
      "hp": 50,
      "repairRate": null,
      "type": 70
    },
    "1016": {
      "class": 6,
      "eligibility": "organic",
      "healRate": null,
      "hp": 45,
      "repairRate": null,
      "type": 70
    },
    "1018": {
      "class": 6,
      "eligibility": "organic",
      "healRate": null,
      "hp": 50,
      "repairRate": null,
      "type": 70
    },
    "1021": {
      "class": 3,
      "eligibility": "unverified",
      "healRate": 0.0,
      "hp": 2700,
      "repairRate": 0.0,
      "type": 80
    },
    "103": {
      "class": 3,
      "eligibility": "unverified",
      "healRate": 0.0,
      "hp": 1800,
      "repairRate": 0.0,
      "type": 80
    },
    "104": {
      "class": 3,
      "eligibility": "unverified",
      "healRate": 1.5,
      "hp": 2100,
      "repairRate": 0.0,
      "type": 80
    },
    "105": {
      "class": 3,
      "eligibility": "unverified",
      "healRate": 0.0,
      "hp": 1800,
      "repairRate": 0.0,
      "type": 80
    },
    "1055": {
      "class": 11,
      "eligibility": "ineligible",
      "healRate": null,
      "hp": 1,
      "repairRate": null,
      "type": 60
    },
    "1057": {
      "class": 11,
      "eligibility": "ineligible",
      "healRate": null,
      "hp": 1,
      "repairRate": null,
      "type": 60
    },
    "1060": {
      "class": 58,
      "eligibility": "unverified",
      "healRate": null,
      "hp": 7,
      "repairRate": null,
      "type": 70
    },
    "109": {
      "class": 3,
      "eligibility": "unverified",
      "healRate": 0.10000000149011612,
      "hp": 2400,
      "repairRate": 0.0,
      "type": 80
    },
    "11": {
      "class": 36,
      "eligibility": "organic",
      "healRate": null,
      "hp": 60,
      "repairRate": null,
      "type": 70
    },
    "1103": {
      "class": 22,
      "eligibility": "unverified",
      "healRate": null,
      "hp": 110,
      "repairRate": null,
      "type": 70
    },
    "1104": {
      "class": 22,
      "eligibility": "unverified",
      "healRate": null,
      "hp": 40,
      "repairRate": null,
      "type": 70
    },
    "1105": {
      "class": 13,
      "eligibility": "unverified",
      "healRate": null,
      "hp": 175,
      "repairRate": null,
      "type": 70
    },
    "1119": {
      "class": 11,
      "eligibility": "ineligible",
      "healRate": null,
      "hp": 1,
      "repairRate": null,
      "type": 60
    },
    "1120": {
      "class": 12,
      "eligibility": "organic",
      "healRate": null,
      "hp": 250,
      "repairRate": null,
      "type": 70
    },
    "1122": {
      "class": 12,
      "eligibility": "organic",
      "healRate": null,
      "hp": 280,
      "repairRate": null,
      "type": 70
    },
    "1123": {
      "class": 6,
      "eligibility": "organic",
      "healRate": null,
      "hp": 30,
      "repairRate": null,
      "type": 70
    },
    "1125": {
      "class": 6,
      "eligibility": "organic",
      "healRate": null,
      "hp": 40,
      "repairRate": null,
      "type": 70
    },
    "1126": {
      "class": 23,
      "eligibility": "organic",
      "healRate": null,
      "hp": 60,
      "repairRate": null,
      "type": 70
    },
    "1128": {
      "class": 23,
      "eligibility": "organic",
      "healRate": null,
      "hp": 65,
      "repairRate": null,
      "type": 70
    },
    "1129": {
      "class": 0,
      "eligibility": "organic",
      "healRate": null,
      "hp": 35,
      "repairRate": null,
      "type": 70
    },
    "1131": {
      "class": 0,
      "eligibility": "organic",
      "healRate": null,
      "hp": 40,
      "repairRate": null,
      "type": 70
    },
    "1132": {
      "class": 12,
      "eligibility": "organic",
      "healRate": null,
      "hp": 250,
      "repairRate": null,
      "type": 70
    },
    "1134": {
      "class": 12,
      "eligibility": "organic",
      "healRate": null,
      "hp": 300,
      "repairRate": null,
      "type": 70
    },
    "1142": {
      "class": 58,
      "eligibility": "unverified",
      "healRate": null,
      "hp": 14,
      "repairRate": null,
      "type": 70
    },
    "1155": {
      "class": 0,
      "eligibility": "organic",
      "healRate": null,
      "hp": 35,
      "repairRate": null,
      "type": 70
    },
    "116": {
      "class": 3,
      "eligibility": "unverified",
      "healRate": 0.0,
      "hp": 2100,
      "repairRate": 0.0,
      "type": 80
    },
    "1167": {
      "class": 11,
      "eligibility": "ineligible",
      "healRate": null,
      "hp": 1,
      "repairRate": null,
      "type": 60
    },
    "1169": {
      "class": 11,
      "eligibility": "ineligible",
      "healRate": null,
      "hp": 1,
      "repairRate": null,
      "type": 60
    },
    "117": {
      "class": 27,
      "eligibility": "unverified",
      "healRate": 0.0,
      "hp": 1080,
      "repairRate": 0.0,
      "type": 80
    },
    "1189": {
      "class": 3,
      "eligibility": "unverified",
      "healRate": 0.0,
      "hp": 2000,
      "repairRate": 0.0,
      "type": 80
    },
    "12": {
      "class": 3,
      "eligibility": "unverified",
      "healRate": 0.5,
      "hp": 1200,
      "repairRate": 0.0,
      "type": 80
    },
    "1225": {
      "class": 12,
      "eligibility": "organic",
      "healRate": null,
      "hp": 100,
      "repairRate": null,
      "type": 70
    },
    "1227": {
      "class": 12,
      "eligibility": "organic",
      "healRate": null,
      "hp": 120,
      "repairRate": null,
      "type": 70
    },
    "1228": {
      "class": 12,
      "eligibility": "organic",
      "healRate": null,
      "hp": 120,
      "repairRate": null,
      "type": 70
    },
    "1230": {
      "class": 12,
      "eligibility": "organic",
      "healRate": null,